[
  {
    "indicator_id": "ev-real-ms-installcore:detection_family:0",
    "record_id": "ev-real-ms-installcore",
    "indicator_type": "detection_family",
    "indicator_value": "PUA:Win32/InstallCore",
    "normalized_value": "puawin32installcore",
    "source_field": "software_name",
    "match_scope": "report_level",
    "match_strength": "informational",
    "false_positive_risk": "medium",
    "requires_human_review": true,
    "notes": "Detection-family text is source context; it is not an installed-app identity verdict.",
    "execution_gating_eligible": false
  },
  {
    "indicator_id": "ev-real-ms-installcore:installer_family:1",
    "record_id": "ev-real-ms-installcore",
    "indicator_type": "installer_family",
    "indicator_value": "InstallCore",
    "normalized_value": "installcore",
    "source_field": "software_name",
    "match_scope": "installed_app",
    "match_strength": "medium",
    "false_positive_risk": "medium",
    "requires_human_review": true,
    "notes": "Family-name overlap is a high-false-positive review hint and requires local identity checks.",
    "execution_gating_eligible": false
  },
  {
    "indicator_id": "ev-real-ms-installcore:behavior_hint:2",
    "record_id": "ev-real-ms-installcore",
    "indicator_type": "behavior_hint",
    "indicator_value": "forced_installation",
    "normalized_value": "forced_installation",
    "source_field": "behavior_categories",
    "match_scope": "report_level",
    "match_strength": "informational",
    "false_positive_risk": "medium",
    "requires_human_review": true,
    "notes": "Behavior context is explanation-only and never identifies software.",
    "execution_gating_eligible": false
  },
  {
    "indicator_id": "ev-real-ms-installcore:behavior_hint:3",
    "record_id": "ev-real-ms-installcore",
    "indicator_type": "behavior_hint",
    "indicator_value": "browser_hijacking",
    "normalized_value": "browser_hijacking",
    "source_field": "behavior_categories",
    "match_scope": "report_level",
    "match_strength": "informational",
    "false_positive_risk": "medium",
    "requires_human_review": true,
    "notes": "Behavior context is explanation-only and never identifies software.",
    "execution_gating_eligible": false
  },
  {
    "indicator_id": "ev-real-ms-installcore:behavior_hint:4",
    "record_id": "ev-real-ms-installcore",
    "indicator_type": "behavior_hint",
    "indicator_value": "malicious_bundling",
    "normalized_value": "malicious_bundling",
    "source_field": "behavior_categories",
    "match_scope": "report_level",
    "match_strength": "informational",
    "false_positive_risk": "medium",
    "requires_human_review": true,
    "notes": "Behavior context is explanation-only and never identifies software.",
    "execution_gating_eligible": false
  },
  {
    "indicator_id": "ev-real-ms-fusioncore:detection_family:0",
    "record_id": "ev-real-ms-fusioncore",
    "indicator_type": "detection_family",
    "indicator_value": "PUA:Win32/FusionCore",
    "normalized_value": "puawin32fusioncore",
    "source_field": "software_name",
    "match_scope": "report_level",
    "match_strength": "informational",
    "false_positive_risk": "medium",
    "requires_human_review": true,
    "notes": "Detection-family text is source context; it is not an installed-app identity verdict.",
    "execution_gating_eligible": false
  },
  {
    "indicator_id": "ev-real-ms-fusioncore:installer_family:1",
    "record_id": "ev-real-ms-fusioncore",
    "indicator_type": "installer_family",
    "indicator_value": "FusionCore",
    "normalized_value": "fusioncore",
    "source_field": "software_name",
    "match_scope": "installed_app",
    "match_strength": "medium",
    "false_positive_risk": "medium",
    "requires_human_review": true,
    "notes": "Family-name overlap is a high-false-positive review hint and requires local identity checks.",
    "execution_gating_eligible": false
  },
  {
    "indicator_id": "ev-real-ms-fusioncore:behavior_hint:2",
    "record_id": "ev-real-ms-fusioncore",
    "indicator_type": "behavior_hint",
    "indicator_value": "malicious_bundling",
    "normalized_value": "malicious_bundling",
    "source_field": "behavior_categories",
    "match_scope": "report_level",
    "match_strength": "informational",
    "false_positive_risk": "medium",
    "requires_human_review": true,
    "notes": "Behavior context is explanation-only and never identifies software.",
    "execution_gating_eligible": false
  },
  {
    "indicator_id": "ev-real-ms-slimware:detection_family:0",
    "record_id": "ev-real-ms-slimware",
    "indicator_type": "detection_family",
    "indicator_value": "PUA:Win32/Slimware",
    "normalized_value": "puawin32slimware",
    "source_field": "software_name",
    "match_scope": "report_level",
    "match_strength": "informational",
    "false_positive_risk": "medium",
    "requires_human_review": true,
    "notes": "Detection-family text is source context; it is not an installed-app identity verdict.",
    "execution_gating_eligible": false
  },
  {
    "indicator_id": "ev-real-ms-slimware:installer_family:1",
    "record_id": "ev-real-ms-slimware",
    "indicator_type": "installer_family",
    "indicator_value": "Slimware",
    "normalized_value": "slimware",
    "source_field": "software_name",
    "match_scope": "installed_app",
    "match_strength": "medium",
    "false_positive_risk": "medium",
    "requires_human_review": true,
    "notes": "Family-name overlap is a high-false-positive review hint and requires local identity checks.",
    "execution_gating_eligible": false
  },
  {
    "indicator_id": "ev-real-ms-slimware:behavior_hint:2",
    "record_id": "ev-real-ms-slimware",
    "indicator_type": "behavior_hint",
    "indicator_value": "ad_popup",
    "normalized_value": "ad_popup",
    "source_field": "behavior_categories",
    "match_scope": "report_level",
    "match_strength": "informational",
    "false_positive_risk": "medium",
    "requires_human_review": true,
    "notes": "Behavior context is explanation-only and never identifies software.",
    "execution_gating_eligible": false
  },
  {
    "indicator_id": "ev-real-ms-slimware:behavior_hint:3",
    "record_id": "ev-real-ms-slimware",
    "indicator_type": "behavior_hint",
    "indicator_value": "malicious_bundling",
    "normalized_value": "malicious_bundling",
    "source_field": "behavior_categories",
    "match_scope": "report_level",
    "match_strength": "informational",
    "false_positive_risk": "medium",
    "requires_human_review": true,
    "notes": "Behavior context is explanation-only and never identifies software.",
    "execution_gating_eligible": false
  },
  {
    "indicator_id": "ev-real-ms-slimware:behavior_hint:4",
    "record_id": "ev-real-ms-slimware",
    "indicator_type": "behavior_hint",
    "indicator_value": "other_user_rights_violation",
    "normalized_value": "other_user_rights_violation",
    "source_field": "behavior_categories",
    "match_scope": "report_level",
    "match_strength": "informational",
    "false_positive_risk": "medium",
    "requires_human_review": true,
    "notes": "Behavior context is explanation-only and never identifies software.",
    "execution_gating_eligible": false
  },
  {
    "indicator_id": "ev-real-ms-piriformbundler:detection_family:0",
    "record_id": "ev-real-ms-piriformbundler",
    "indicator_type": "detection_family",
    "indicator_value": "PUA:Win32/PiriformBundler",
    "normalized_value": "puawin32piriformbundler",
    "source_field": "software_name",
    "match_scope": "report_level",
    "match_strength": "informational",
    "false_positive_risk": "high",
    "requires_human_review": true,
    "notes": "Detection-family text is source context; it is not an installed-app identity verdict.",
    "execution_gating_eligible": false
  },
  {
    "indicator_id": "ev-real-ms-piriformbundler:installer_family:1",
    "record_id": "ev-real-ms-piriformbundler",
    "indicator_type": "installer_family",
    "indicator_value": "PiriformBundler",
    "normalized_value": "piriformbundler",
    "source_field": "software_name",
    "match_scope": "installed_app",
    "match_strength": "medium",
    "false_positive_risk": "high",
    "requires_human_review": true,
    "notes": "Family-name overlap is a high-false-positive review hint and requires local identity checks.",
    "execution_gating_eligible": false
  },
  {
    "indicator_id": "ev-real-ms-piriformbundler:publisher_hint:2",
    "record_id": "ev-real-ms-piriformbundler",
    "indicator_type": "publisher_hint",
    "indicator_value": "Piriform",
    "normalized_value": "piriform",
    "source_field": "publisher",
    "match_scope": "publisher_level",
    "match_strength": "weak",
    "false_positive_risk": "high",
    "requires_human_review": true,
    "notes": "Publisher evidence is auxiliary and cannot form a match by itself.",
    "execution_gating_eligible": false
  },
  {
    "indicator_id": "ev-real-ms-piriformbundler:behavior_hint:3",
    "record_id": "ev-real-ms-piriformbundler",
    "indicator_type": "behavior_hint",
    "indicator_value": "malicious_bundling",
    "normalized_value": "malicious_bundling",
    "source_field": "behavior_categories",
    "match_scope": "report_level",
    "match_strength": "informational",
    "false_positive_risk": "high",
    "requires_human_review": true,
    "notes": "Behavior context is explanation-only and never identifies software.",
    "execution_gating_eligible": false
  },
  {
    "indicator_id": "ev-real-ms-mediaarena:detection_family:0",
    "record_id": "ev-real-ms-mediaarena",
    "indicator_type": "detection_family",
    "indicator_value": "PUA:Win32/MediaArena",
    "normalized_value": "puawin32mediaarena",
    "source_field": "software_name",
    "match_scope": "report_level",
    "match_strength": "informational",
    "false_positive_risk": "medium",
    "requires_human_review": true,